{
  "schema": "urn:algaguard:schema:onboarding:qr-onboarding-exchange-response:v1",
  "schemaVersion": "1.0.0",
  "sessionId": "30000000-0000-4000-8000-000000000001",
  "deviceId": "AG-000001",
  "createdAt": "2030-01-01T00:00:00.000Z",
  "expiresAt": "2030-01-01T00:15:00.000Z",
  "serviceUuid": "0000a1a0-0000-1000-8000-00805f9b34fb",
  "sessionToken": "AAAAAAAAAAAAAAAAAAAAAAAAAAAAAAAAAAAAAAAAAAA",
  "bindingGrant": "AAAAAAAAAAAAAAAAAAAAAAAAAAAAAAAAAAAAAAAAAAAAAAAAAAAAAAAAAAAAAAAAAAAAAAAAAAAAAAAAAAAAAAAAAAAAAAAAAAAAAAAAAAAAAAAAAAAAAAAAAAAAAAAAAAAAAAAAAAAAAAAAAAAAAAAAAAAAAAAAAAAAAAAAAAAAAAAAAAAAAAAAAAAAAAAAAA"
}
